{
  "suite_id": "forgeops-approval-policy-v1",
  "suite_version": "1.0",
  "schema_ref": "contracts/forgeops-authority-policy/1.0/schema.json",
  "base_request": {
    "operation_mode": "EXECUTE",
    "capability": "AVAILABLE",
    "exact_authority": "ALLOWED",
    "approved_candidate": true,
    "current_revision": true,
    "all_preflights_passed": true,
    "effect": {"destructive": true, "external": true},
    "destructive_actions": "ALLOWED",
    "external_runtime": "AVAILABLE",
    "external_side_effects": "ALLOWED",
    "base_revision": 17,
    "candidate_id": "CAND-EFFECT-17",
    "action_identity": {
      "identity_kind": "NETWORK",
      "network_host": "api.example.com:443"
    },
    "target": "release/forgeops-v1",
    "tenant": "tenant-fixture-a",
    "trusted_issuer": "forgeops-control-plane",
    "trusted_audience": "forgeops-effect-gateway",
    "trusted_approver_subject": "reviewer-fixture-a",
    "trusted_policy_version": "approval-policy-v1",
    "trusted_key_id": "fixture-key-v1",
    "trusted_signature_ref": "signature-fixture-ref-v1",
    "signature_verified": true,
    "approval_decision": "APPROVED",
    "validation_time": "2026-07-22T12:00:00Z",
    "contract": {"artifact_id": "contract-fixture", "content_hash": "sha256:contract-v1"},
    "plan": {"plan_id": "plan-fixture", "content_hash": "sha256:plan-v1"},
    "policy": {"policy_id": "effect-policy", "version": "approval-policy-v1"},
    "diff": {"content_hash": "sha256:diff-v1"},
    "payload": {"content_hash": "sha256:payload-v1", "media_type": "application/json"},
    "approval": {
      "candidate_id": "CAND-EFFECT-17",
      "action_identity": {
        "identity_kind": "NETWORK",
        "network_host": "api.example.com:443"
      },
      "target": "release/forgeops-v1",
      "tenant": "tenant-fixture-a",
      "issuer": "forgeops-control-plane",
      "audience": "forgeops-effect-gateway",
      "approver_subject": "reviewer-fixture-a",
      "policy_version": "approval-policy-v1",
      "key_id": "fixture-key-v1",
      "not_before": "2026-07-22T11:55:00Z",
      "expires_at": "2026-07-22T12:05:00Z",
      "nonce": "nonce-fixture-effect-17",
      "signature_ref": "signature-fixture-ref-v1",
      "effect_hash": ""
    }
  },
  "cases": [
    {"id": "POSITIVE_DESTRUCTIVE_EXTERNAL", "kind": "positive", "scenario": "evaluate", "mutations": [], "expected_result": "PASSED"},
    {"id": "POSITIVE_LOCAL_NON_DESTRUCTIVE", "kind": "positive", "scenario": "evaluate", "mutations": [{"path": "effect.destructive", "value": false}, {"path": "effect.external", "value": false}], "expected_result": "PASSED"},
    {"id": "NEGATIVE_DESTRUCTIVE_DENIED", "kind": "negative", "scenario": "evaluate", "mutations": [{"path": "destructive_actions", "value": "DENIED"}], "expected_error": "EFFECT_GATE_DENIED"},
    {"id": "NEGATIVE_DESTRUCTIVE_UNKNOWN", "kind": "negative", "scenario": "evaluate", "mutations": [{"path": "destructive_actions", "value": "UNKNOWN"}], "expected_error": "EFFECT_GATE_DENIED"},
    {"id": "NEGATIVE_EXTERNAL_AUTHORITY_DENIED", "kind": "negative", "scenario": "evaluate", "mutations": [{"path": "external_side_effects", "value": "DENIED"}], "expected_error": "EFFECT_GATE_DENIED"},
    {"id": "NEGATIVE_EXTERNAL_AUTHORITY_UNKNOWN", "kind": "negative", "scenario": "evaluate", "mutations": [{"path": "external_side_effects", "value": "UNKNOWN"}], "expected_error": "EFFECT_GATE_DENIED"},
    {"id": "NEGATIVE_EXTERNAL_RUNTIME_UNAVAILABLE", "kind": "negative", "scenario": "evaluate", "mutations": [{"path": "external_runtime", "value": "UNAVAILABLE"}], "expected_error": "AUTHORITY_CAPABILITY_DENIED"},
    {"id": "NEGATIVE_EXTERNAL_RUNTIME_UNKNOWN", "kind": "negative", "scenario": "evaluate", "mutations": [{"path": "external_runtime", "value": "UNKNOWN"}], "expected_error": "AUTHORITY_CAPABILITY_DENIED"},
    {"id": "NEGATIVE_AUTHORITY_DENIED", "kind": "negative", "scenario": "evaluate", "mutations": [{"path": "exact_authority", "value": "DENIED"}], "expected_error": "AUTHORITY_CAPABILITY_DENIED"},
    {"id": "NEGATIVE_AUTHORITY_UNKNOWN", "kind": "negative", "scenario": "evaluate", "mutations": [{"path": "exact_authority", "value": "UNKNOWN"}], "expected_error": "AUTHORITY_CAPABILITY_DENIED"},
    {"id": "NEGATIVE_CAPABILITY_UNKNOWN", "kind": "negative", "scenario": "evaluate", "mutations": [{"path": "capability", "value": "UNKNOWN"}], "expected_error": "AUTHORITY_CAPABILITY_DENIED"},
    {"id": "NEGATIVE_CANDIDATE_UNAPPROVED", "kind": "negative", "scenario": "evaluate", "mutations": [{"path": "approved_candidate", "value": false}], "expected_error": "AUTHORITY_CAPABILITY_DENIED"},
    {"id": "NEGATIVE_STALE_REVISION", "kind": "negative", "scenario": "evaluate", "mutations": [{"path": "current_revision", "value": false}], "expected_error": "AUTHORITY_CAPABILITY_DENIED"},
    {"id": "NEGATIVE_EXPLORE_MODE", "kind": "negative", "scenario": "evaluate", "mutations": [{"path": "operation_mode", "value": "EXPLORE"}], "expected_error": "AUTHORITY_CAPABILITY_DENIED"},
    {"id": "NEGATIVE_PREFLIGHT_FAILED", "kind": "negative", "scenario": "evaluate", "mutations": [{"path": "all_preflights_passed", "value": false}], "expected_error": "AUTHORITY_CAPABILITY_DENIED"},
    {"id": "NEGATIVE_APPROVAL_MISSING", "kind": "negative", "scenario": "evaluate", "mutations": [{"path": "approval", "remove": true}], "expected_error": "APPROVAL_MISSING"},
    {"id": "NEGATIVE_APPROVAL_REJECTED", "kind": "negative", "scenario": "evaluate", "mutations": [{"path": "approval_decision", "value": "REJECTED"}], "expected_error": "APPROVAL_REJECTED"},
    {"id": "NEGATIVE_NOT_BEFORE", "kind": "negative", "scenario": "evaluate", "mutations": [{"path": "approval.not_before", "value": "2026-07-22T12:00:01Z"}], "expected_error": "APPROVAL_EXPIRED"},
    {"id": "NEGATIVE_EXPIRED", "kind": "negative", "scenario": "evaluate", "mutations": [{"path": "approval.expires_at", "value": "2026-07-22T11:59:59Z"}], "expected_error": "APPROVAL_EXPIRED"},
    {"id": "NEGATIVE_WRONG_ISSUER", "kind": "negative", "scenario": "evaluate", "mutations": [{"path": "approval.issuer", "value": "other-issuer"}], "expected_error": "APPROVAL_AUDIENCE_INVALID"},
    {"id": "NEGATIVE_WRONG_AUDIENCE", "kind": "negative", "scenario": "evaluate", "mutations": [{"path": "approval.audience", "value": "other-audience"}], "expected_error": "APPROVAL_AUDIENCE_INVALID"},
    {"id": "NEGATIVE_WRONG_TENANT", "kind": "negative", "scenario": "evaluate", "mutations": [{"path": "approval.tenant", "value": "tenant-fixture-b"}], "expected_error": "APPROVAL_TENANT_INVALID"},
    {"id": "NEGATIVE_WRONG_APPROVER", "kind": "negative", "scenario": "evaluate", "mutations": [{"path": "approval.approver_subject", "value": "reviewer-fixture-b"}], "expected_error": "APPROVAL_SIGNATURE_INVALID"},
    {"id": "NEGATIVE_WRONG_KEY", "kind": "negative", "scenario": "evaluate", "mutations": [{"path": "approval.key_id", "value": "fixture-key-v2"}], "expected_error": "APPROVAL_SIGNATURE_INVALID"},
    {"id": "NEGATIVE_SIGNATURE_REF", "kind": "negative", "scenario": "evaluate", "mutations": [{"path": "approval.signature_ref", "value": "signature-fixture-ref-invalid"}], "expected_error": "APPROVAL_SIGNATURE_INVALID"},
    {"id": "NEGATIVE_SIGNATURE_UNVERIFIED", "kind": "negative", "scenario": "evaluate", "mutations": [{"path": "signature_verified", "value": false}], "expected_error": "APPROVAL_SIGNATURE_INVALID"},
    {"id": "NEGATIVE_BIND_CANDIDATE", "kind": "negative", "scenario": "evaluate", "mutations": [{"path": "candidate_id", "value": "CAND-EFFECT-18"}], "expected_error": "APPROVAL_BINDING_MISMATCH"},
    {"id": "NEGATIVE_BIND_ACTION_IDENTITY", "kind": "negative", "scenario": "evaluate", "mutations": [{"path": "action_identity.network_host", "value": "api.example.com"}], "expected_error": "APPROVAL_BINDING_MISMATCH"},
    {"id": "NEGATIVE_BIND_TARGET", "kind": "negative", "scenario": "evaluate", "mutations": [{"path": "target", "value": "release/forgeops-v2"}], "expected_error": "APPROVAL_BINDING_MISMATCH"},
    {"id": "NEGATIVE_BIND_REVISION", "kind": "negative", "scenario": "evaluate", "mutations": [{"path": "base_revision", "value": 18}], "expected_error": "APPROVAL_BINDING_MISMATCH"},
    {"id": "NEGATIVE_BIND_CONTRACT", "kind": "negative", "scenario": "evaluate", "mutations": [{"path": "contract.content_hash", "value": "sha256:contract-v2"}], "expected_error": "APPROVAL_BINDING_MISMATCH"},
    {"id": "NEGATIVE_BIND_PLAN", "kind": "negative", "scenario": "evaluate", "mutations": [{"path": "plan.content_hash", "value": "sha256:plan-v2"}], "expected_error": "APPROVAL_BINDING_MISMATCH"},
    {"id": "NEGATIVE_BIND_POLICY", "kind": "negative", "scenario": "evaluate", "mutations": [{"path": "policy.policy_id", "value": "effect-policy-v2"}], "expected_error": "APPROVAL_BINDING_MISMATCH"},
    {"id": "NEGATIVE_BIND_DIFF", "kind": "negative", "scenario": "evaluate", "mutations": [{"path": "diff.content_hash", "value": "sha256:diff-v2"}], "expected_error": "APPROVAL_BINDING_MISMATCH"},
    {"id": "NEGATIVE_BIND_PAYLOAD", "kind": "negative", "scenario": "evaluate", "mutations": [{"path": "payload.content_hash", "value": "sha256:payload-v2"}], "expected_error": "APPROVAL_BINDING_MISMATCH"},
    {"id": "NEGATIVE_BIND_POLICY_VERSION", "kind": "negative", "scenario": "evaluate", "mutations": [{"path": "approval.policy_version", "value": "approval-policy-v2"}], "expected_error": "APPROVAL_BINDING_MISMATCH"},
    {"id": "NEGATIVE_BIND_NOT_BEFORE", "kind": "negative", "scenario": "evaluate", "mutations": [{"path": "approval.not_before", "value": "2026-07-22T11:56:00Z"}], "expected_error": "APPROVAL_BINDING_MISMATCH"},
    {"id": "NEGATIVE_BIND_EXPIRES_AT", "kind": "negative", "scenario": "evaluate", "mutations": [{"path": "approval.expires_at", "value": "2026-07-22T12:04:00Z"}], "expected_error": "APPROVAL_BINDING_MISMATCH"},